,Title,Artist,Album,Popularity,Play Count,Track URL,Acousticness,Danceability,Loudness,Valence,Energy,Liveness,Tempo,Explicit,Instrumentalness,Duration (ms),Genres,Sub_Genre,Main Genre,Release Year
0,Just the Way You Are,Bruno Mars,Doo-Wops & Hooligans,87,10,https://open.spotify.com/track/7BqBn9nzAq8spo5e7cZ0dJ,0.0134,0.635,-5.379,0.424,0.841,0.0622,109.021,False,0.0,220734,"dance pop, pop",pop,Pop,2010
1,Love The Way You Lie,Eminem  & Rihanna,Recovery,86,17,https://open.spotify.com/track/15JINEqzVMv3SvJTAXAKED,0.241,0.749,-5.034,0.641,0.925,0.52,86.989,True,0.0,263373,"detroit hip hop, hip hop, rap",hip hop,Hip-Hop,2010
2,Bad Romance,Lady Gaga,The Fame Monster (Deluxe Edition),85,23,https://open.spotify.com/track/0SiywuOBRcynK0uKGWdCnn,0.00314,0.696,-3.755,0.714,0.921,0.0842,119.001,True,5.24e-05,294573,"art pop, dance pop, pop",dance pop,Pop,2010
3,Alors on danse - Radio Edit,Stromae,Cheese,82,12,https://open.spotify.com/track/2GYHyAoLWpkxLVa4oYTVko,0.0994,0.791,-9.206,0.714,0.59,0.065,119.951,False,0.00203,206067,"belgian pop, g-house",g-house,EDM,2010
4,TiK ToK,Kesha,Animal (Expanded Edition),86,18,https://open.spotify.com/track/0HPD5WQqrq7wPWR7P7Dw1i,0.0991,0.755,-2.718,0.714,0.837,0.289,120.028,False,0.0,199693,"dance pop, pop",pop,Pop,2010
5,Memories (feat. Kid Cudi),David Guetta  & Kid Cudi,One Love (Deluxe),72,31,https://open.spotify.com/track/4dTaAiV9xFFCxnPur9c9yL,0.0015,0.561,-6.103,0.498,0.87,0.246,129.98,False,2.82e-06,210093,"big room, dance pop, edm, pop, pop dance",dance pop,Pop,2010
6,Dynamite,Taio Cruz,The Rokstarr Hits Collection,82,15,https://open.spotify.com/track/2CEgGE6aESpnmtfiZwYlbV,0.00379,0.751,-3.724,0.816,0.783,0.036,119.975,False,0.0,202613,"dance pop, pop, pop rap",pop,Pop,2010
7,Only Girl (In The World),Rihanna,Loud (Japan Version),85,13,https://open.spotify.com/track/2ENexcMEMsYk0rVJigVD3i,0.112,0.789,-4.233,0.638,0.706,0.0586,125.911,False,1.71e-05,235493,"barbadian pop, pop, urban contemporary",pop,Pop,2010
8,California Gurls,Katy Perry  & Snoop Dogg,Teenage Dream: The Complete Confection,79,19,https://open.spotify.com/track/6tS3XVuOyu10897O3ae7bi,0.00446,0.791,-3.729,0.425,0.754,0.163,125.014,False,0.0,234653,pop,pop,Pop,2010
9,"Hey, Soul Sister",Train,"Save Me, San Francisco (Golden Gate Edition)",86,19,https://open.spotify.com/track/4HlFJV71xXKIGcU3kRyttv,0.185,0.673,-4.44,0.795,0.886,0.0826,97.012,False,0.0,216773,"dance pop, neo mellow, pop, pop rock",neo mellow,Rock,2010
10,Talking to the Moon,Bruno Mars,Doo-Wops & Hooligans,85,10,https://open.spotify.com/track/161DnLWsx1i3u1JT05lzqU,0.511,0.498,-4.721,0.0784,0.59,0.107,145.867,False,0.0,217867,"dance pop, pop",pop,Pop,2010
11,Baby,Justin Bieber  & Ludacris,My World 2.0,85,10,https://open.spotify.com/track/6epn3r7S14KUqlReYr77hA,0.0401,0.728,-5.237,0.535,0.859,0.111,65.043,False,0.0,214240,"canadian pop, pop",pop,Pop,2010
12,Danza Kuduro,Don Omar  & Lucenzo,Meet The Orphans,85,14,https://open.spotify.com/track/2a1o6ZejUi8U3wzzOtCOYw,0.0846,0.4,-4.89,0.878,0.915,0.0503,88.917,False,0.0,198773,"latin hip hop, puerto rican pop, reggaeton, trap latino, urbano latino",puerto rican pop,Pop,2010
13,DJ Got Us Fallin' In Love (feat. Pitbull),Usher  & Pitbull,Raymond v Raymond (Expanded Edition),84,22,https://open.spotify.com/track/4356Typ82hUiFAynbLYbPn,0.0338,0.663,-3.398,0.654,0.861,0.082,119.963,False,0.0,220800,"atl hip hop, contemporary r&b, dance pop, pop, r&b, rap, south carolina hip hop, urban contemporary",contemporary r&b,R&B,2010
14,Not Afraid,Eminem,Recovery,83,17,https://open.spotify.com/track/7Ie9W94M7OjPoZVV216Xus,0.529,0.855,-1.19,0.668,0.954,0.205,114.635,True,0.0,248133,"detroit hip hop, hip hop, rap",hip hop,Hip-Hop,2010
15,Down,Jay Sean  & Lil Wayne,All Or Nothing,82,16,https://open.spotify.com/track/6cmm1LMvZdB5zsCwX5BjqE,0.0101,0.727,-4.498,0.728,0.68,0.0821,132.012,False,0.0,212507,"dance pop, pop, pop rap",pop,Pop,2010
16,Fireflies,Owl City,Ocean Eyes,81,12,https://open.spotify.com/track/3DamFFqW32WihKkTVlwTYQ,0.0275,0.512,-6.797,0.472,0.662,0.118,180.114,False,0.0,228347,"indietronica, pop",pop,Pop,2010
17,Rude Boy,Rihanna,Rated R,81,13,https://open.spotify.com/track/60jzFy6Nn4M0iD1d94oteF,0.113,0.563,-4.496,0.812,0.75,0.0788,173.906,True,0.0,222920,"barbadian pop, pop, urban contemporary",pop,Pop,2010
18,Club Can't Handle Me (feat. David Guetta),Flo Rida  & David Guetta,Only One Flo (Part 1),81,8,https://open.spotify.com/track/6ebkx7Q5tTxrCxKq4GYj0Y,0.0283,0.616,-3.911,0.473,0.869,0.064,127.966,False,0.0,234560,"dance pop, miami hip hop, pop, pop rap",miami hip hop,Hip-Hop,2010
19,Cooler Than Me - Single Mix,Mike Posner  & Gigamesh,31 Minutes to Takeoff,79,12,https://open.spotify.com/track/2V4bv1fNWfTcyRJKmej6Sj,0.179,0.768,-4.63,0.625,0.82,0.689,129.965,False,0.0,213293,"dance pop, pop, pop dance, pop rap",pop,Pop,2010
20,Airplanes (feat. Hayley Williams of Paramore),B.o.B  & Hayley Williams,B.o.B Presents: The Adventures of Bobby Ray,79,12,https://open.spotify.com/track/6lV2MSQmRIkycDScNtrBXO,0.11,0.66,-4.285,0.377,0.867,0.0368,93.033,True,0.0,180480,"atl hip hop, dance pop, pop rap, rap, southern hip hop",dance pop,Pop,2010
21,Just A Dream,Nelly,5,78,12,https://open.spotify.com/track/3ZdJffjzJWFimSQyxgGIxN,0.0421,0.531,-6.161,0.103,0.752,0.12,89.917,False,0.0,237800,"dance pop, gangster rap, hip hop, pop rap, rap, st louis rap, urban contemporary",gangster rap,Hip-Hop,2010
22,Teenage Dream,Katy Perry,Teenage Dream,77,12,https://open.spotify.com/track/5jzKL4BDMClWqRguW5qZvh,0.0162,0.719,-4.582,0.591,0.798,0.134,120.011,False,2.34e-06,227741,pop,pop,Pop,2010
23,OMG (feat. will.i.am),Usher  & will.i.am,Raymond v Raymond (Expanded Edition),77,22,https://open.spotify.com/track/1bM50INir8voAkVoKuvEUI,0.198,0.781,-5.81,0.326,0.745,0.36,129.998,False,1.14e-05,269493,"atl hip hop, contemporary r&b, dance pop, pop, r&b, rap, south carolina hip hop, urban contemporary",contemporary r&b,R&B,2010
24,What You Know,Two Door Cinema Club,Tourist History,77,10,https://open.spotify.com/track/3GBApU0NuzH4hKZq4NOSdA,0.00073,0.563,-4.239,0.775,0.739,0.0822,139.0,False,1.45e-05,191707,"indie rock, indietronica, irish rock, modern alternative rock, modern rock, northern irish indie",indietronica,Indie,2010
25,Billionaire (feat. Bruno Mars),Travie McCoy  & Bruno Mars,Billionaire (feat. Bruno Mars),76,1,https://open.spotify.com/track/2M9ULmQwTaTGmAdXaXpfz5,0.297,0.633,-6.403,0.659,0.673,0.206,86.776,True,0.0,211160,pop rap,pop rap,Hip-Hop,2010
26,Telephone,Lady Gaga  & Beyoncé,The Fame Monster (Deluxe Edition),76,23,https://open.spotify.com/track/4TCL0qqKyqsMZml0G3M9IM,0.00521,0.824,-5.903,0.716,0.836,0.112,122.014,False,0.000817,220640,"art pop, dance pop, pop",dance pop,Pop,2010
27,Replay,Iyaz,Replay,76,1,https://open.spotify.com/track/5vlEg2fT4cFWAqU5QptIpQ,0.173,0.706,-6.323,0.195,0.751,0.168,91.031,False,0.0,182307,"dance pop, pop rap, post-teen pop",pop rap,Hip-Hop,2010
28,Break Your Heart,Taio Cruz,The Rokstarr Hits Collection,76,15,https://open.spotify.com/track/7ElF5zxOwYP4qVSWVvse3W,0.0327,0.607,-4.217,0.568,0.934,0.0909,122.01,False,0.0,201547,"dance pop, pop, pop rap",pop,Pop,2010
29,Nothin' on You (feat. Bruno Mars),B.o.B  & Bruno Mars,B.o.B Presents: The Adventures of Bobby Ray,78,12,https://open.spotify.com/track/59dLtGBS26x7kc0rHbaPrq,0.386,0.688,-5.814,0.743,0.853,0.0862,103.993,False,0.0,268320,"atl hip hop, dance pop, pop rap, rap, southern hip hop",dance pop,Pop,2010
30,What's My Name?,Rihanna  & Drake,Loud (Japan Version),75,13,https://open.spotify.com/track/6DkXLzBQT7cwXmTyzAB1DJ,0.182,0.689,-2.972,0.561,0.784,0.0843,99.954,True,0.0,263173,"barbadian pop, pop, urban contemporary",pop,Pop,2010
31,Bottoms Up (feat. Nicki Minaj),Trey Songz  & Nicki Minaj,"Passion, Pain & Pleasure (Deluxe Version)",75,20,https://open.spotify.com/track/4AYX69oFP3UOS1CFmV9UfO,0.0205,0.844,-5.283,0.331,0.601,0.385,73.989,True,0.0,242013,"dance pop, r&b, southern hip hop, trap, urban contemporary",r&b,R&B,2010
32,Empire State of Mind (Part II) Broken Down,Alicia Keys,The Element Of Freedom,75,14,https://open.spotify.com/track/5sra5UY6sD658OabHL3QtI,0.74,0.484,-7.784,0.142,0.368,0.118,92.923,False,3.82e-05,216480,"neo soul, pop, r&b",pop,Pop,2010
33,Back To December,Taylor Swift,Speak Now,74,14,https://open.spotify.com/track/3DrjZArsPsoqbLzUZZV1Id,0.117,0.529,-4.663,0.286,0.67,0.334,141.893,False,0.0,293027,pop,pop,Pop,2010
34,Over,Drake,Thank Me Later,74,14,https://open.spotify.com/track/6BdgtqiV3oXNqBikezwdvC,0.0107,0.35,-5.614,0.45,0.845,0.123,99.643,True,0.0,233560,"canadian hip hop, canadian pop, hip hop, rap, toronto rap",canadian pop,Pop,2010
35,Alejandro,Lady Gaga,The Fame Monster (Deluxe Edition),75,23,https://open.spotify.com/track/1HHeOs6zRdF8Ck58easiAY,0.000397,0.623,-6.63,0.36,0.793,0.375,98.998,False,0.0015,274213,"art pop, dance pop, pop",dance pop,Pop,2010
36,Animal,Neon Trees,Habits,74,8,https://open.spotify.com/track/1fBl642IhJOE5U319Gy2Go,0.000346,0.482,-5.611,0.74,0.833,0.365,148.039,False,0.0,212293,"modern rock, neo mellow, pop rock, pov: indie",neo mellow,Rock,2010
37,The Time (Dirty Bit),Black Eyed Peas,The Beginning (Deluxe),73,15,https://open.spotify.com/track/7vWFaMq63AwkFDhS2OAg5u,0.0662,0.816,-7.798,0.436,0.813,0.602,127.979,False,2.77e-06,307640,"dance pop, pop, pop rap",pop,Pop,2010
38,Like A G6,Far East Movement  & The Cataracs  & DEV,Free Wired,73,10,https://open.spotify.com/track/4DvhkX2ic4zWkQeWMwQ2qf,0.00676,0.435,-8.126,0.778,0.837,0.117,124.913,False,0.0,216893,"asian american hip hop, dance pop, pop rap",dance pop,Pop,2010
39,BedRock,Young Money  & Lloyd,We Are Young Money,73,15,https://open.spotify.com/track/3iL2l5gUqyPS6vDwJFgJTR,0.102,0.733,-6.163,0.557,0.664,0.191,148.005,True,0.0,288133,"dirty south rap, pop rap, rap, southern hip hop, trap",pop rap,Hip-Hop,2010
40,Your Love Is My Drug,Kesha,Animal (Expanded Edition),73,18,https://open.spotify.com/track/6vc2Jq2vaGu8z326kSrw92,0.00681,0.826,-3.891,0.756,0.612,0.0889,120.057,False,0.0,187133,"dance pop, pop",pop,Pop,2010
41,Stereo Love - Radio Edit,Edward Maya  & Vika Jigulina,Stereo Love,73,6,https://open.spotify.com/track/1AguHaKOuggrVTebp7cZEI,0.0346,0.799,-3.896,0.586,0.783,0.0757,127.041,False,0.0186,184573,"romanian house, romanian pop",romanian pop,Hip-Hop,2010
42,Te Amo,Rihanna,Rated R,73,13,https://open.spotify.com/track/4YYHgF9dWyVSor0GtrBzdf,0.541,0.567,-5.455,0.751,0.707,0.1,171.917,True,0.000176,208427,"barbadian pop, pop, urban contemporary",pop,Pop,2010
43,Right Above It,Lil Wayne  & Drake,I Am Not A Human Being,73,13,https://open.spotify.com/track/1kMuU3TNQvHbqvXCWBodmP,0.0435,0.376,-4.348,0.463,0.841,0.578,76.052,True,0.0,271947,"hip hop, new orleans rap, pop rap, rap, trap",new orleans rap,Hip-Hop,2010
44,If We Ever Meet Again (Featuring Katy Perry),Timbaland  & Katy Perry,Shock Value II,73,13,https://open.spotify.com/track/360UM2DaiHZPRu0EsrOvMp,0.00481,0.652,-7.371,0.394,0.605,0.0605,126.091,False,0.0,292707,"dance pop, pop, pop rap",pop,Pop,2010
45,Mine,Taylor Swift,Speak Now,73,14,https://open.spotify.com/track/0dBW6ZsW8skfvoRfgeerBF,0.00265,0.624,-2.94,0.658,0.757,0.189,121.07,False,1.87e-06,230707,pop,pop,Pop,2010
46,Deuces (feat. Tyga & Kevin McCall),Chris Brown  & Tyga  & Kevin McCall,F.A.M.E. (Expanded Edition),72,18,https://open.spotify.com/track/6wN4nT2qy3MQc098yL3Eu9,0.0324,0.692,-5.109,0.217,0.736,0.0787,73.987,True,0.0,276560,"r&b, rap",rap,Hip-Hop,2010
47,Do You Remember,Jay Sean  & Sean Paul  & Lil Jon,All Or Nothing,72,16,https://open.spotify.com/track/6A5NlmBCsCGbJ27jHQgKV5,0.0204,0.854,-4.896,0.818,0.674,0.101,125.845,False,0.0,210800,"dance pop, pop, pop rap",pop,Pop,2010
48,Take It Off,Kesha,Animal (Expanded Edition),72,18,https://open.spotify.com/track/0WCiI0ddWiu5F2kSHgfw5S,4.14e-05,0.729,-5.292,0.74,0.675,0.0867,125.036,False,0.00126,215200,"dance pop, pop",pop,Pop,2010
49,Teach Me How to Dougie,Cali Swag District,The Kickback,71,15,https://open.spotify.com/track/61LtVmmkGr8P9I2tSPvdpf,0.2,0.846,-4.981,0.512,0.438,0.0939,85.013,True,9.43e-05,237480,pop rap,pop rap,Hip-Hop,2010
50,Carry Out (Featuring Justin Timberlake),Timbaland  & Justin Timberlake,Shock Value II,71,13,https://open.spotify.com/track/2DHc2e5bBn4UzY0ENVFrUl,0.114,0.531,-6.693,0.272,0.574,0.256,115.68,False,0.0308,232467,"dance pop, pop, pop rap",pop,Pop,2010
51,I Need A Dollar,Aloe Blacc,Good Things,71,13,https://open.spotify.com/track/3oUphdZVPyrsprZ8FgbmQS,0.199,0.84,-7.123,0.955,0.481,0.0873,95.497,False,0.0,243053,"pop soul, r&b",r&b,R&B,2010
52,Impossible,Shontelle,No Gravity,71,12,https://open.spotify.com/track/1T8PwF3JhIiWwBhun23RNe,0.385,0.6,-3.631,0.529,0.624,0.125,90.036,False,0.0,226533,"barbadian pop, dance pop, post-teen pop",dance pop,Pop,2010
53,If I Die Young,The Band Perry,The Band Perry,71,11,https://open.spotify.com/track/4u26EevCNXMhlvE1xFBJwX,0.348,0.606,-6.611,0.362,0.497,0.275,130.739,False,0.0,222773,"contemporary country, country, country dawn, country road",country,Country,2010
54,Find Your Love,Drake,Thank Me Later,71,14,https://open.spotify.com/track/4BycRneKmOs6MhYG9THsuX,0.0211,0.627,-6.006,0.758,0.614,0.0286,96.038,False,0.0,208947,"canadian hip hop, canadian pop, hip hop, rap, toronto rap",canadian pop,Pop,2010
55,My Chick Bad,Ludacris  & Nicki Minaj,Battle Of The Sexes (Deluxe),70,17,https://open.spotify.com/track/3bMNprrp2JDKZsGbiXpsJl,0.172,0.624,-6.782,0.757,0.723,0.483,84.789,True,0.0,216933,"atl hip hop, dance pop, dirty south rap, hip hop, old school atlanta hip hop, pop rap, rap, southern hip hop, trap",dance pop,Pop,2010
56,Whatcha Say,Jason Derulo,Jason Derulo,70,9,https://open.spotify.com/track/67T6l4q3zVjC5nZZPXByU8,0.0444,0.615,-5.507,0.711,0.711,0.145,144.036,False,0.0,221253,"dance pop, pop",pop,Pop,2010
57,Imma Be,Black Eyed Peas,THE E.N.D. (THE ENERGY NEVER DIES),70,15,https://open.spotify.com/track/0oJMv049q8hEkes9w0L1J4,0.179,0.597,-6.963,0.413,0.517,0.307,92.035,True,0.0,257560,"dance pop, pop, pop rap",pop,Pop,2010
58,Blah Blah Blah (feat. 3OH!3),Kesha  & 3OH!3,Animal (Expanded Edition),71,18,https://open.spotify.com/track/7lWUJpax919G4JdaFEVmCy,0.0843,0.752,-3.173,0.519,0.836,0.424,120.003,True,0.000425,172053,"dance pop, pop",pop,Pop,2010
59,Young Forever,JAY-Z  & Mr Hudson,The Blueprint 3,70,15,https://open.spotify.com/track/35srNkJVToAzYiZzron1FY,0.417,0.637,-3.214,0.103,0.69,0.211,140.329,True,0.0,253907,"east coast hip hop, gangster rap, hip hop, pop rap, rap",gangster rap,Hip-Hop,2010
60,Your Song - Bonus Track,Ellie Goulding,Bright Lights (Lights Re-pack / Bonus Version),69,17,https://open.spotify.com/track/1a9hBnJodCsNcp0HoJAObp,0.941,0.547,-12.002,0.402,0.197,0.144,133.85,False,0.000756,191827,"indietronica, metropopolis, pop, uk pop",metropopolis,Pop,2010
61,Magic (feat. Rivers Cuomo),B.o.B  & Rivers Cuomo,B.o.B Presents: The Adventures of Bobby Ray,69,12,https://open.spotify.com/track/5uHYcK0nbEYgRaFTY5BqnP,0.0127,0.549,-4.11,0.787,0.932,0.347,82.439,False,0.0,196133,"atl hip hop, dance pop, pop rap, rap, southern hip hop",dance pop,Pop,2010
62,Half of My Heart,John Mayer,Battle Studies,69,11,https://open.spotify.com/track/7hR5toSPEgwFZ78jfHdANM,0.435,0.681,-9.327,0.731,0.593,0.106,115.058,False,0.000117,250373,"neo mellow, singer-songwriter",singer-songwriter,Pop,2010
63,Stuck Like Glue,Sugarland,The Incredible Machine,69,11,https://open.spotify.com/track/0JcKdUGNR7zI4jJDLyYXbi,0.329,0.702,-4.764,0.836,0.795,0.0505,83.961,False,0.0,247587,"contemporary country, country, country dawn, country road",country,Country,2010
64,We No Speak Americano (Edit),Yolanda Be Cool  & DCup,We No Speak Americano,69,6,https://open.spotify.com/track/37dYAkMa4lzRCH6kDbMT1L,0.0748,0.902,-5.003,0.745,0.805,0.0914,124.985,False,0.0823,157438,"australian dance, australian house, bass house",australian house,EDM,2010
65,I Like It,Enrique Iglesias  & Pitbull,Euphoria,68,18,https://open.spotify.com/track/7HacCTm33hZYYN8DXpCYuG,0.021,0.648,-2.881,0.73,0.942,0.0594,129.007,False,0.0,231373,"dance pop, latin pop, mexican pop",latin pop,Pop,2010
66,Ridin' Solo,Jason Derulo,Jason Derulo,68,9,https://open.spotify.com/track/6BaxqcoEM9r3LXisTyJjST,0.128,0.442,-4.02,0.578,0.83,0.129,89.338,False,0.0,215747,"dance pop, pop",pop,Pop,2010
67,Eenie Meenie,Sean Kingston,Eenie Meenie EP,68,3,https://open.spotify.com/track/45O0tUN9Bh6LH4eNxQ07AT,0.0348,0.734,-3.241,0.836,0.639,0.102,121.212,False,0.0,201653,"dance pop, miami hip hop, pop",miami hip hop,Hip-Hop,2010
68,Heartbreak Warfare,John Mayer,Battle Studies,68,11,https://open.spotify.com/track/4gs07VlJST4bdxGbBsXVue,0.191,0.624,-8.113,0.311,0.554,0.299,97.031,False,0.00131,269720,"neo mellow, singer-songwriter",singer-songwriter,Pop,2010
69,STARSTRUKK (feat. Katy Perry),3OH!3  & Katy Perry  & Matt Squire,WANT (Deluxe),68,15,https://open.spotify.com/track/1hBM2D1ULT3aeKuddSwPsK,0.00175,0.607,-5.579,0.232,0.805,0.231,139.894,True,0.0,202667,"electropowerpop, pop punk, pop rap, post-teen pop",pop punk,Pop,2010
70,Forget You,CeeLo Green,The Lady Killer,68,14,https://open.spotify.com/track/7AqISujIaWcY3h5zrOqt5v,0.134,0.696,-3.682,0.772,0.875,0.159,127.39,False,0.0,222733,atl hip hop,atl hip hop,Hip-Hop,2010
71,Need You Now,Lady A,Need You Now,68,12,https://open.spotify.com/track/7h70RTLbnhDyPGXjl3iEhh,0.0298,0.581,-4.433,0.316,0.717,0.243,107.884,False,0.000186,236440,"contemporary country, country, country dawn, country pop, country road",country,Country,2010
72,Can't Be Tamed,Miley Cyrus,Can't Be Tamed,67,12,https://open.spotify.com/track/2r6DdaSbkbwoPzuK6NjLPn,0.0287,0.63,-2.919,0.743,0.91,0.196,116.98,False,0.0,168213,pop,pop,Pop,2010
73,Hey Daddy (Daddy's Home),Usher,Raymond v Raymond (Expanded Edition),67,22,https://open.spotify.com/track/030OCtLMrljNhp8OWHBWW3,0.000176,0.59,-4.262,0.352,0.698,0.107,95.975,False,0.0,224093,"atl hip hop, contemporary r&b, dance pop, pop, r&b, rap, south carolina hip hop, urban contemporary",contemporary r&b,R&B,2010
74,Gold Dust - Radio Edit,DJ Fresh,Gold Dust,67,6,https://open.spotify.com/track/3uIGef7OSXkFdqxjFWn2o6,0.255,0.451,-0.74,0.295,0.948,0.392,176.985,False,0.0,192447,"dancefloor dnb, drum and bass, uk dance",drum and bass,EDM,2010
75,How Low,Ludacris,Battle Of The Sexes (Deluxe),67,17,https://open.spotify.com/track/1WtTLtofvcjQM3sXSMkDdX,0.00248,0.785,-6.977,0.418,0.498,0.224,143.96,True,1.23e-06,201587,"atl hip hop, dance pop, dirty south rap, hip hop, old school atlanta hip hop, pop rap, rap, southern hip hop, trap",dance pop,Pop,2010
76,Kickstarts,Example,Won't Go Quietly,67,14,https://open.spotify.com/track/07WEDHF2YwVgYuBugi2ECO,0.00374,0.61,-4.455,0.657,0.836,0.358,126.056,False,0.0,181827,"hip house, uk dance",uk dance,Dance,2010
77,Whataya Want from Me,Adam Lambert,For Your Entertainment,66,14,https://open.spotify.com/track/2rDwdvBma1O1eLzo29p2cr,0.00706,0.44,-4.732,0.445,0.683,0.0593,185.948,False,0.0,227320,"dance pop, idol, pop, post-teen pop",idol,Pop,2010
78,In My Head,Jason Derulo,Jason Derulo,66,9,https://open.spotify.com/track/5BoIP8Eha5hwmRVURkC2Us,0.0266,0.762,-4.15,0.851,0.748,0.348,110.009,False,0.0,199027,"dance pop, pop",pop,Pop,2010
79,Say Aah (feat. Fabolous),Trey Songz  & Fabolous,Ready (Deluxe),65,20,https://open.spotify.com/track/2fQ6sBFWaLv2Gxos4igHLy,0.00453,0.724,-3.614,0.81,0.87,0.833,93.01,False,0.0,207547,"dance pop, r&b, southern hip hop, trap, urban contemporary",r&b,R&B,2010
80,Misery,Maroon 5,Hands All Over (Deluxe),65,18,https://open.spotify.com/track/6KBYk8OFtod7brGuZ3Y67q,0.000315,0.704,-4.874,0.726,0.81,0.216,102.98,False,0.0,216200,pop,pop,Pop,2010
81,My First Kiss (feat. Ke$ha),3OH!3  & Kesha,Streets Of Gold,65,14,https://open.spotify.com/track/17tDv8WA8IhqE8qzuQn707,0.00564,0.682,-4.166,0.827,0.889,0.36,138.021,False,0.0,192440,"electropowerpop, pop punk, pop rap, post-teen pop",pop punk,Pop,2010
82,Try Sleeping with a Broken Heart,Alicia Keys,The Element Of Freedom,64,14,https://open.spotify.com/track/1yK9LISg5uBOOW5bT2Wm0i,0.158,0.496,-5.155,0.549,0.821,0.13,110.977,False,0.246,249013,"neo soul, pop, r&b",pop,Pop,2010
83,For the First Time,The Script,Science & Faith,64,12,https://open.spotify.com/track/09ZcYBGFX16X8GMDrvqQwt,0.0328,0.396,-4.78,0.358,0.629,0.183,173.794,True,0.0,252853,"celtic rock, pop",pop,Pop,2010
84,King of Anything,Sara Bareilles,Kaleidoscope Heart,64,13,https://open.spotify.com/track/3VA8T3rNy5V24AXxNK5u9E,0.461,0.676,-4.172,0.81,0.762,0.0574,119.003,False,0.0,207493,"acoustic pop, lilith, neo mellow, pop rock, post-teen pop",lilith,Pop,2010
85,One - Radio Edit,Swedish House Mafia,One (Your Name),64,8,https://open.spotify.com/track/41KPpw0EZCytxNkmEMJVgr,0.0075,0.802,-6.564,0.622,0.781,0.147,125.026,False,0.825,169920,"edm, pop dance, progressive electro house",pop dance,Pop,2010
86,Wavin' Flag,K'NAAN,Troubadour,63,14,https://open.spotify.com/track/0zREtnLmVnt8KUJZZbSdla,0.13,0.625,-6.416,0.717,0.699,0.238,75.974,False,0.0,220520,reggae fusion,reggae fusion,Reggae,2010
87,Dancing On My Own - Radio Edit,Robyn,Body Talk,63,15,https://open.spotify.com/track/7g13jf3zqlP5S68Voo5v9m,0.00202,0.573,-6.045,0.219,0.926,0.127,117.047,False,0.0117,278080,"dance pop, electropop, neo-synthpop, scandipop, swedish electropop, swedish pop",electropop,Hip-Hop,2010
88,Man Down,Rihanna,Loud,63,11,https://open.spotify.com/track/454h9zAIuTe1eJyw9iTnj4,0.0406,0.479,-4.03,0.536,0.906,0.051,155.887,True,0.0,266987,"barbadian pop, pop, urban contemporary",pop,Pop,2010
89,No Hands (feat. Roscoe Dash & Wale),Waka Flocka Flame  & Roscoe Dash  & Wale,No Hands (feat. Roscoe Dash & Wale),63,1,https://open.spotify.com/track/6GgPsuz0HEO0nrO2T0QhDv,0.00544,0.76,-6.366,0.361,0.595,0.241,131.497,True,0.0,263773,"atl hip hop, dirty south rap, rap, southern hip hop, trap",dirty south rap,Hip-Hop,2010
90,Beautiful Monster,Ne-Yo,Libra Scale,61,10,https://open.spotify.com/track/2Q99zPXVqCPN5RaZawvJWZ,0.209,0.708,-6.99,0.494,0.771,0.277,128.013,False,5.32e-06,251573,"dance pop, pop, r&b, urban contemporary",pop,Pop,2010
91,The Flood,Take That,Progress,61,11,https://open.spotify.com/track/2a3U3GTCvrcma7wetBtOpi,0.0378,0.514,-6.077,0.138,0.83,0.122,100.631,False,1.43e-06,289360,"boy band, europop, talent show",europop,Pop,2010
92,Don't Stop Believin' (Glee Cast Version) - Cover of Journey,Glee Cast,"Glee: The Music, Volume 1",60,17,https://open.spotify.com/track/6rjnRocdCULjLF61x2NR5e,0.0376,0.473,-4.034,0.271,0.604,0.103,123.848,False,0.0,232000,"glee club, post-teen pop",post-teen pop,Pop,2010
93,Starry Eyed,Ellie Goulding,Bright Lights (Lights Re-pack / Bonus Version),58,17,https://open.spotify.com/track/14OF4JQOIm4hb0GfG5nfyF,0.135,0.504,-5.346,0.596,0.814,0.324,149.967,False,1.42e-05,176613,"indietronica, metropopolis, pop, uk pop",metropopolis,Pop,2010
94,Bromance - Avicii's Radio Edit,Tim Berg  & Avicii,Bromance (Remixes),58,4,https://open.spotify.com/track/0xHQuV3c496RjG7ocxBINZ,0.199,0.681,-8.901,0.0377,0.804,0.149,126.016,False,0.899,218616,"edm, pop dance, progressive electro house",pop dance,Pop,2010
95,All Time Low,The Wanted,The Wanted,57,14,https://open.spotify.com/track/4kPf4MbDp81GfVHLISdByL,0.35,0.69,-5.022,0.787,0.617,0.0789,134.023,False,0.0,205200,"boy band, dance pop, pop, post-teen pop",dance pop,Pop,2010
96,Higher,The Saturdays,Headlines,57,12,https://open.spotify.com/track/0QVAlchLCx15ZLSoR9Wg1B,0.049,0.639,-3.292,0.596,0.862,0.264,117.011,False,6.81e-06,207613,"dance pop, girl group, post-teen pop, talent show",girl group,Pop,2010
97,"All I Do Is Win (feat. T-Pain, Ludacris, Snoop Dogg & Rick Ross)",DJ Khaled  & Ludacris  & T-Pain  & Snoop Dogg  & Rick Ross,"All I Do Is Win (feat. T-Pain, Ludacris, Snoop Dogg & Rick Ross)",56,1,https://open.spotify.com/track/75FT1IPlCYCs5DAYbR9mjE,0.014,0.544,-3.616,0.277,0.781,0.161,150.1,True,0.0,232507,"hip hop, miami hip hop, pop rap, rap",miami hip hop,Hip-Hop,2010
98,Live Like We're Dying,Kris Allen,Kris Allen,55,13,https://open.spotify.com/track/1HfxPaJggVwFsvOtHbVzMz,0.0273,0.589,-2.948,0.94,0.893,0.343,92.011,False,0.0,212507,"acoustic pop, idol, neo mellow, viral pop",idol,Pop,2010
99,Today Was A Fairytale,Taylor Swift,Today Was A Fairytale,55,1,https://open.spotify.com/track/4pFvEWbjBpPUdYRQly0THs,0.0307,0.491,-4.5,0.344,0.703,0.167,157.988,False,5.72e-06,242480,pop,pop,Pop,2010
100,Rolling in the Deep,Adele,21,83,11,https://open.spotify.com/track/1c8gk2PeTE04A1pIDH9YMk,0.138,0.73,-5.114,0.507,0.769,0.0473,104.948,True,0.0,228093,"british soul, pop, pop soul, uk pop",pop,Pop,2011
101,"Moves Like Jagger - Studio Recording From ""The Voice"" Performance",Maroon 5  & Christina Aguilera,Hands All Over,76,13,https://open.spotify.com/track/7LcfRTgAVTs5pQGEQgUEzN,0.0111,0.722,-4.477,0.62,0.758,0.308,128.047,False,0.0,201160,pop,pop,Pop,2011
102,Party Rock Anthem,LMFAO  & Lauren Bennett  & GoonRock,Sorry For Party Rocking,73,10,https://open.spotify.com/track/0IkKz2J93C94Ei4BvDop7P,0.0189,0.75,-4.21,0.359,0.727,0.266,129.993,False,0.0,262173,"dance pop, pop, pop rap",pop,Pop,2011
103,Firework,Katy Perry,Teenage Dream,75,12,https://open.spotify.com/track/4r6eNCsrZnQWJzzvFh4nlg,0.141,0.638,-5.039,0.648,0.832,0.113,124.071,False,0.0,227893,pop,pop,Pop,2011
104,Grenade,Bruno Mars,Doo-Wops & Hooligans,81,10,https://open.spotify.com/track/2tJulUYLDKOg9XrtVkMgcJ,0.148,0.704,-7.273,0.245,0.558,0.107,110.444,False,0.0,222091,"dance pop, pop",pop,Pop,2011
105,Sure Thing,Miguel,All I Want Is You,91,13,https://open.spotify.com/track/0JXXNGljqupsJaZsgSbMZV,0.0267,0.684,-8.127,0.498,0.607,0.191,81.001,False,0.000307,195373,r&b,r&b,R&B,2011
106,Paradise,Coldplay,Mylo Xyloto,88,14,https://open.spotify.com/track/6nek1Nin9q48AVZcWs9e9D,0.0509,0.449,-6.761,0.212,0.585,0.0833,139.631,False,8.75e-05,278719,"permanent wave, pop",pop,Pop,2011
107,Pumped Up Kicks,Foster The People,Torches,87,10,https://open.spotify.com/track/7w87IxuO7BDcJ3YUqCyMTT,0.145,0.733,-5.849,0.965,0.71,0.0956,127.975,False,0.115,239600,"indietronica, modern alternative rock, modern rock, rock",modern alternative rock,Rock,2011
